id,bio
Q000007,"A Representative and a Senator from Indiana and a Vice President of the United States; born in Indianapolis, Marion County, Ind., February 4, 1947; attended the public schools of Phoenix, Ariz., and Huntington, Ind.; graduated, DePauw University, Greencastle, Ind., 1969; graduated, Indiana University, Indianapolis 1974; admitted to the Indiana bar in 1974 and commenced practice in Huntington; served in the Indiana National Guard 1969-1975; associate publisher of the Huntington Herald Press; elected as a Republican to the Ninety-fifth Congress in 1976; reelected to the Ninety-sixth Congress (January 3, 1977-January 3, 1981); was not a candidate in 1980 for reelection to the House of Representatives, but was elected to the United States Senate; reelected in 1986 and served from January 3, 1981, until January 3, 1989, when he resigned to become Vice President of the United States; chairman, Select Committee to Study the Committee System (Ninety-eighth Congress); elected Vice President of the United States in 1988 with President George Herbert Walker Bush and was inaugurated January 20, 1989; unsuccessful candidate for reelection as Vice President in 1992; is a resident of Paradise Valley, Ariz."
M000122,"A Representative from New York; born in New York City December 10, 1902; attended the grade and high schools; was graduated from the law department of New York University at New York City in 1925; was admitted to the bar in June 1926 and commenced practice in New York City; served as assistant United States district attorney in 1930 and 1931; elected as a Republican to the Seventy-fourth Congress (January 3, 1935-January 3, 1937); unsuccessful candidate for reelection in 1936 to the Seventy-fifth Congress; resumed the practice of law; elected as an American Laborite to the Seventy-sixth and to the five succeeding Congresses (January 3, 1939-January 3, 1951); unsuccessful candidate for reelection in 1950 to the Eighty-second Congress; unsuccessful American-Labor Party candidate for mayor of New York City in 1949; practiced law in Washington, D.C., and later in New York City, until his death in New York City August 9, 1954; interment in Woodlawn Cemetery, New York City (the Bronx), N.Y."
C000807,"(Nephew of Clarence Dennis Coughlin), a Representative from Pennsylvania; born in Wilkes-Barre, Luzerne County, Pa., April 11, 1929; A.B., Yale University, New Haven, Conn., 1950; M.B.A., Harvard University, Cambridge, Mass., 1954; LL.B., Temple University Evening Law School, Philadelphia, Pa., 1958; lawyer, private practice; manufacturer; United States Marine Corps, 1950-1952; member of the Pennsylvania state house of representatives, 1965-1967; member of the Pennsylvania state senate, 1967-1969; elected as a Republican to the Ninety-first and to the eleven succeeding Congresses (January 3, 1969-January 3, 1993); was not a candidate for renomination to the One Hundred Third Congress in 1992; died on November 30, 2001, in Mathews, Va.; interment in Arlington National Cemetery, Arlington, Va."
C000220,"A Representative and a Senator from New Jersey; born in Franklin Park, Somerset County, N.J., April 16, 1904; attended the public schools of Poughkeepsie, N.Y.; graduated from Rutgers University, New Brunswick, N.J., in 1925 and from Columbia University Law School, New York City, in 1928; admitted to the bar in 1928 and commenced practice in New York City; member of the Rahway (N.J.) Common Council 1938-1942; member, New Jersey house of assembly 1943-1944; trustee of Rutgers University; elected as a Republican to the Seventy-ninth and to the four succeeding Congresses, and served from January 3, 1945, until his resignation August 16, 1953; president of The Fund for the Republic 1953-1954; elected as a Republican to the United States Senate in 1954; reelected in 1960, 1966, and again in 1972 and served from January 3, 1955, to January 3, 1979; unsuccessful candidate for renomination in 1978; resumed the practice of law; lecturer at Rutgers University's Eagleton Institute of Politics; resided in Rahway, N.J., until his death in Washington, D.C., on March 5, 1982; interment at New Cemetery, Somerville, N.J."
S000055,"A Senator from North Carolina; born in Laurinburg, N.C., August 20, 1917; attended Presbyterian Junior College; graduated, University of North Carolina, Chapel Hill, 1939; graduated, University of North Carolina Law School 1946; special agent, Federal Bureau of Investigation 1941-1942; parachute infantry, United States Army 1942-1945; North Carolina National Guard 1948-1960; assistant director, Institute of Government, University of North Carolina 1946-1948; lawyer in private practice 1948-1960, 1965-1969, 1985-1986; North Carolina State senator 1953-1955; Governor of North Carolina 1961-1965; president of Duke University 1969-1985; elected as a Democrat to the United States Senate on November 4, 1986, for the unexpired term of John East ending January 3, 1987, and for the six-year term ending January 3, 1993, and served from November 5, 1986, to January 3, 1993; unsuccessful candidate for reelection in 1992; chairman, Select Committee on Ethics (1992); resumed the practice of law in North Carolina and Washington, D.C.; died in Durham, N.C. on April 18, 1998; interment in Duke University Chapel."
S000168,"a Representative from Florida; born in Miami, Miami-Dade County, Fla., November 1, 1961; graduated from the Deerborne School, Coral Gables, Fla., 1979; B.A., University of Miami, Coral Gables, Fla., 1983; M.P.A., Harvard University, Cambridge, Mass., 1995; journalist; unsuccessful candidate for election to the One Hundred Sixteenth Congress in 2018; elected as a Republican to the One Hundred Seventeenth and to the succeeding Congress (January 3, 2021&ndash;present)."
M000795,"A Representative from Minnesota; born in Clarkfield, Yellow Medicine County, Minn., March 19, 1942; graduated from Worthington High School, Worthington, Minn., 1960; B.A, St. Olaf College, 1964, J.D., University of Chicago, 1967; admitted to the bar in 1967 and commenced the practice of law in Minneapolis, Minn.; assistant and associate professor, University of Wyoming College of Law, 1970-1977; consultant, House Judiciary subcommittee on administrative law, 1975; Fulbright Lecturer, Helsinki, Finland, 1976; practiced law in Montevideo, Minn., 1977-1992; member, Montevideo school board, 1989-1992; elected as a Democrat to the One Hundred Third and to the three succeeding Congresses (January 3, 1993-January 3, 2001); unsuccessful candidate for reelection to the One Hundred Seventh Congress in 2000; judge in the Minnesota Court of Appeals, 2002-2012; is a resident of St. Paul, Minn."
M000015,"A Representative from Rhode Island; born in Johnstown, Cambria County, Pa., July 13, 1948; attended public schools; B.S., United States Naval Academy, Annapolis, Md., 1970; United States Navy, 1970-1975; United States Naval Reserve, 1975-1995; J.D., Suffolk University Law School, Boston, Ma., 1978; admitted to the Rhode Island bar in 1978; elected as a Republican to the One Hundred First and to the two succeeding Congresses (January 3, 1989-January 3, 1995); was not a candidate for reelection in 1994, but was an unsuccessful candidate for Governor of Rhode Island; president, Bryant University, Smithfield, R.I., 1996 to 2020."
C000758,"A Senator from Kentucky; born in Somerset, Pulaski County, Ky., August 23, 1901; attended the public schools at Somerset and Centre College, Danville, Ky.; graduated from Yale College 1923; attended Harvard Law School 1923-1925; admitted to the bar in 1928 and commenced practice in Somerset, Ky.; member, Kentucky house of representatives 1928-1930; judge of Pulaski County, Ky., 1930-1938; member of the board of trustees of the University of Kentucky 1935-1946; served during the Second World War in the United States Army 1942-1946, attaining the rank of captain; elected circuit judge of the twenty-eighth judicial district of Kentucky in 1945 and served until his resignation in November 1946; elected on November 5, 1946, as a Republican to the United States Senate to fill the vacancy caused by the resignation of Albert B. Chandler and served from November 6, 1946, to January 3, 1949; unsuccessful candidate for reelection in 1948; resumed the practice of law; delegate to the General Assembly of the United Nations in 1949 and alternate delegate in 1950 and 1951; served as adviser to the Secretary of State at the London and Brussels meetings of the Council of Ministers of the North Atlantic Treaty Organization in 1950; elected on November 4, 1952, as a Republican to the United States Senate to fill the vacancy caused by the death of Virgil M. Chapman and served from November 5, 1952, to January 3, 1955; unsuccessful candidate for reelection in 1954; Ambassador to India and Nepal 1955-1956; delegate, United Nations General Assembly 1968; elected on November 6, 1956, as a Republican to the United States Senate to fill the vacancy caused by the death of Alben W. Barkley; reelected in 1960, and again in 1966, and served from November 7, 1956, to January 3, 1973; was not a candidate for reelection in 1972; Ambassador to the German Democratic Republic 1974-1976; resumed the practice of law in Washington, D.C., and was a resident of Somerset, Ky., and Washington, D.C., until his death in Washington, D.C., February 21, 1991; interment in Arlington National Cemetery, Arlington, Va."
E000287,"<p>A Representative from Illinois; born in Chicago, Cook County, Ill., on November 29, 1959; B.A., Sarah Lawrence College, Bronxville, N.Y., 1981; M.A., Northwestern University, Evanston, Ill., 1985; staff, Office of Communications, Executive Office of the President, William Jefferson Clinton, 1993-1999; bank executive; elected as a Democrat to the One Hundred Eighth Congress and to the two succeeding Congresses until his resignation on January 2, 2009 (January 3, 2003-January 2, 2009); chair, House Democratic Caucus (One Hundred Tenth Congress); elected to the 111th Congress, but declined his seat; White House Chief of Staff, 2009-2010; Mayor of Chicago, Ill., 2011-2019; United States Ambassador to Japan, 2021-present.</p>
<div>&nbsp;</div>
<p>.</p>"
M000456,"A Senator from Rhode Island; born in Woonsocket, Providence County, R.I., November 28, 1903; attended parochial schools; graduated from La Salle Academy, Providence, R.I., in 1922, from Providence (R.I.) College in 1926, and from the law department of Boston University, Boston, Mass., in 1929; admitted to the bar the same year and commenced practice in Providence; city solicitor of Central Falls, R.I., 1930-1934; engaged in the real estate and insurance business and was also interested in banking; chairman of the Democratic National Committee 1947-1949; United States district attorney for Rhode Island from 1934 until his resignation in 1940, having been elected Governor; elected Governor of Rhode Island in 1940, 1942, and 1944 and served until his resignation in October 1945, having been appointed solicitor general of the United States; solicitor general until his resignation in October 1946 to become a candidate for United States Senator; elected as a Democrat in 1946 to the United States Senate for the term commencing January 3, 1947, and served until his resignation on August 23, 1949; chairman, Committee on the District of Columbia (Eighty-first Congress); Attorney General of the United States 1949-1952; resumed the practice of law in Washington, D.C., and Providence, R.I.; unsuccessful candidate for nomination as United States Senator in 1960; died in Narragansett, R.I., September 2, 1966; interment in St. Francis Cemetery, Pawtucket, R.I."
E000282,"A Representative from Illinois; born in Atlanta, Logan County, Ill., September 19, 1935; B.S., Millikin University, Decatur, Ill., 1957; J.D., John Marshall School of Law, Chicago, Ill., 1968; United States Army Reserve, 1957-1963, active duty, 1958; assistant state attorney for Livingston County, Ill., 1968-1973; member, Republican State Central Committee, 1986- 1990; member, Illinois state house of representatives, 1974-1991; delegate to the Republican national conventions,1980 and 1984; farmer; appointed chairman of the Biomass Research and Development Technical Advisory Committee, 2001- present; elected as a Republican to the One Hundred Second Congress, by special election, to fill the vacancy caused by the resignation of Edward R. Madigan; reelected to the One Hundred Third and to the three succeeding Congresses, (July 2, 1991-January 3, 2001); was not a candidate for reelection to the One Hundred Seventh Congress; is a resident of Pontiac, Ill."
T000217,"A Representative from Georgia; born in College Park, Fulton County, Ga., February 5, 1925; attended the public schools and Russell High School in East Point, Ga., graduated from Emory University in 1949 and from Woodrow Wilson College of Law in 1957; was admitted to the bar in 1958 and commenced the practice of law in East Point, Ga.; president of an insurance firm; served in the United States Army Medical Corps in 1943; served as navigator with the Air Rescue Service in the United States Army Air Corps, 1944-1946; during the Korean conflict, 1950-1953, served as pilot with the United States Air Force; elected to the Georgia general assembly as State senator from the thirty-fourth senatorial district in 1964; elected as a Republican to the Ninetieth and to the two succeeding Congresses (January 3, 1967-January 3, 1973); was not a candidate in 1972 for reelection to the United States House of Representatives but was an unsuccessful candidate for election to the United States Senate; resumed the practice of law in Atlanta; owns and operates a trucking company; member, Atlanta Regional Commission, 1985; died on September 13, 2022."
C001134,"a Representative from Colorado; born in Denver, Denver County, Colo., December 23, 1980; graduated from Northglenn High School, Northglenn, Colo., 1999; B.S., Regis University, Denver, Colo., 2003; M.D., University of Colorado, Aurora, Colo., 2009; pediatrician; union representative; campaign staff, presidential campaign of Barack H. Obama, 2008; member of the Colorado state house of representatives, 2019-2022; elected as a Democrat to the One Hundred Eighteenth Congress (January 3, 2023-present)."
F000458,"A Representative from Tennessee; born in Memphis, Shelby County, Tenn., February 7, 1973; graduated from Crockett County High School, Alamo, Tenn., 1990; farmer; business owner; elected as a Republican to the One Hundred Twelfth and to the two succeeding Congresses (January 3, 2011-January 3, 2017); was not a candidate for reelection to the One Hundred Fifteenth Congress in 2016."
A000139,"(Wife of James Browning Allen), a Senator from Alabama; born Maryon Pittman in Meridian, Lauderdale County, Miss., November 30, 1925; moved to Birmingham, Ala., 1926; educated in the public schools of Birmingham; attended the University of Alabama; journalist, editor, writer, and lecturer; appointed chairwoman of the Blair House Fine Arts Commission by President Gerald R. Ford 1974; appointed on June 8, 1978, as a Democrat to the United States Senate to fill the vacancy caused by the death of her husband, James B. Allen, and served from June 8, 1978, to November 7, 1978; unsuccessful candidate for renomination to the unexpired term ending January 3, 1981; columnist for The Washington Post 1978-1981; public relations and advertising director for C.G. Sloan &amp; Co., an antique and auction firm; owner, Maryon Allen Company (restoration/design), Birmingham; was a resident of Birmingham, Ala., until her death on July 23, 2018."
B001258,"A Representative from Kansas; born in St. Louis, St. Louis County, Mo., August 2, 1955; B.S., William Jewell College, Liberty, Mo., 1977; chemist; teacher; unsuccessful candidate for election to One Hundred and Ninth Congress in 2004; elected as a Democrat to the One Hundred Tenth Congress (January 3, 2007-January 3, 2009); unsuccessful candidate for reelection to the One Hundred Eleventh Congress in 2008."
P000460,"A Representative and a Senator from Michigan; born in Lapeer, Mich., October 30, 1916; attended the public schools; graduated from Eastern Michigan University, Ypsilanti, Mich., in 1938; administrator of Bureau of Social Aid, Cheboygan County, Mich., 1938-1942; in 1942 enlisted as a private in the United States Army with combat service in the European Theater of Operations; seriously wounded in France in 1945, resulting in the loss of both legs; discharged from the service as a major in 1946; engaged as vocational rehabilitation representative for the Retraining and Reemployment Administration with the United States Labor Department until his resignation in 1947; elected on August 26, 1947, as a Republican to the Eightieth Congress to fill the vacancy caused by the death of Frederick V. Bradley; reelected to the two succeeding Congresses and served from August 26, 1947, until his resignation on November 4, 1952; elected to the United States Senate in 1952 to fill the vacancy caused by the death of Arthur H. Vandenberg and served from November 5, 1952, to January 3, 1953; also elected in 1952 for the term commencing January 3, 1953, and served until January 3, 1959; unsuccessful candidate for reelection in 1958; engaged as an industrial consultant and international securities executive; member of the American Battle Monuments Commission; resided in Queenstown, Md., until his death at Walter Reed Army Hospital, Washington, D.C., November 23, 1979; interment in Arlington National Cemetery, Arlington, Va."
A000370,"a Representative from North Carolina; born in High Point, Guilford County, N.C., May 27, 1946; graduated from West Side High School, Newark, N.J., 1964; B.S., North Carolina Agricultural and Technical State University, Greensboro, N.C., 1968; M.S., North Carolina Agricultural and Technical State University, Greensboro, N.C., 1972; Ph.D., Ohio State University, Columbus, Ohio, 1981; artist; faculty, Bennett College, Greensboro, N.C., 1972-2012; member of the Greensboro, N.C., school board, 1984-1986; member of the Greensboro, N.C., city council, 1987-1994; member of the North Carolina state house of representatives, 1994-2014; elected simultaneously as a Democrat to the One Hundred Thirteenth and One Hundred Fourteenth Congresses, by special election, to fill the vacancy caused by the resignation of United States Representative Melvin L. Watt, and reelected to the four succeeding Congresses (November 4, 2014-present)."
B001260,"a Representative from Florida; born in Detroit, Wayne County, Mich., May 8, 1951; B.B.A., Cleary University, Ann Arbor, Mich., 1975; M.B.A., University of Detroit, Detroit, Mich., 1986; Michigan Air National Guard, 1970-1976; businessman; campaign staff; elected as a Republican to the One Hundred Tenth and to the eight succeeding Congresses (January 3, 2007-present)."
B000468,"A Senator from New Mexico; born in El Paso, Tex., October 3, 1943; attended public schools of Silver City, N.Mex.; graduated, Harvard College 1965 and Stanford Law School 1968; served in the United States Army Reserve 1968-1974; admitted to the New Mexico bar 1968; assistant New Mexico attorney general 1969; counsel to State constitutional convention 1969; commenced private practice in 1970; elected New Mexico attorney general 1979-1982; elected as a Democrat to the United States Senate in 1982; reelected in 1988, 1994, 2000, and 2006, and served from January 3, 1983, to January 3, 2013; chairman, Senate Impeachment Trial Committee (1989-1991), Committee on Energy and Natural Resources (One Hundred Seventh Congress [January 3-20, 2001; June 6, 2001-January 3, 2003], One Hundred Tenth to One Hundred Twelfth Congresses); was not a candidate for reelection to the Senate in 2012."
M000688,"A Representative from Florida; born in Binghamton, Broome County, N.Y., February 4, 1944; attended Horace Mann School, Binghamton, N.Y., 1950; graduated, Miami Edison High School, Fla., 1961; attended the University of Florida, Gainesville, 1961; B.A., Florida Atlantic University, Boca Raton, 1966; teacher, Palm Beach, Fla., and Montgomery County, Md., 1966-1968; administrative assistant to Rep. Paul G. Rogers, 1968-1978; elected as a Democrat to the Ninety-sixth and to the four succeeding Congresses (January 3, 1979-January 3, 1989); was not a candidate for reelection in 1988 but was an unsuccessful candidate for nomination to the United States Senate; is a resident of West Palm Beach, Fla."
B000657,"A Representative from Virginia; born in Washington County, Va., August 1, 1946; graduated from Abingdon High School, Abingdon, Va., 1964; B.A., Roanoke College, Salem, Va., 1968; J.D., University of Virginia School of Law, Charlottesville, Va., 1971; lawyer, private practice; member of the Virginia state senate, 1974-1983; elected as a Democrat to the Ninety-eighth and to the thirteen succeeding Congresses (January 3, 1983-January 3, 2011); unsuccessful candidate for reelection to the One Hundred Twelfth Congress in 2010."
A000059,"Vice President of the United States; born in Baltimore, Md., November 9, 1918; educated in the public schools of Baltimore; attended the Johns Hopkins University; graduated from the University of Baltimore Law School 1947; served in the United States Army during the Second World War and the Korean conflict; practiced law in Baltimore; elected county executive of Baltimore County 1962; elected Governor of Maryland 1966; elected Vice President of the United States on the Republican ticket with President Richard M. Nixon on November 5, 1968; resigned as Governor of Maryland on January 7, 1969; inaugurated 39th Vice President of the United States on January 20, 1969; reelected Vice President, November 7, 1972; charged with accepting bribes and falsifying federal tax returns, pleaded <i>nolo contendere</i> to the latter charge in federal court, and resigned October 10, 1973; international trade executive; was a resident of Rancho Mirage, Calif., and Ocean City, Md.; died September 17, 1996, in Ocean City; cremated, ashes interred at Dulaney Valley Memorial Gardens, Timonium, Md."
L000468,"A Representative from South Dakota; born in Toronto, Deuel County, S.Dak., January 30, 1904; attended the public schools of Toronto, S.Dak., and St. Olaf College, Northfield, Minn.; graduated from the University of South Dakota at Vermillion in 1927; was admitted to the bar in 1927 and practiced law in Hayti, Hamlin County, S.Dak., 1927-1944, and in Watertown, Codington County, S.Dak., 1944-1949; State's attorney for Hamlin County, S.Dak., 1929-1932, 1937-1940; president of the State Board of Agriculture in 1939 and 1940; chairman of the South Dakota Republican Committee in 1947 and 1948; member of the State senate 1941-1944; elected as a Republican to the Eighty-first and to the three succeeding Congresses (January 3, 1949-January 3, 1957); unsuccessful candidate for reelection in 1956 to the Eighty-fifth Congress; resumed the practice of law; died in Silver Spring, Md., January 17, 1972; interment in Parklawn Cemetery, Rockville, Md."
S001225,"a Representative from Illinois; born in Rockford, Winnebago County, Ill., March 18, 1976; graduated from Boylan Central Catholic High School, Rockford, Ill., 1994; B.S., Northern Illinois University, DeKalb, Ill., 1999; meteorologist; elected as a Democrat to the One Hundred Eighteenth Congress (January 2023-present)."
G000320,"A Representative and a Senator from Tennessee; born in Granville, Jackson County, Tenn., December 26, 1907; attended the public schools; graduated from State Teachers' College, Murfreesboro, Tenn., in 1932, and from Nashville (Tenn.) Y.M.C.A. night law school in 1936; taught in the rural schools of Overton and Smith Counties, Tenn., 1926-1930; county superintendent of education of Smith County 1932-1936; admitted to the bar in 1936 and commenced practice in Carthage, Tenn.; Tennessee commissioner of labor 1936-1937; elected as a Democrat to the Seventy-sixth Congress in 1938; reelected to the two succeeding Congresses and served from January 3, 1939, until his resignation on December 4, 1944, to enter the United States Army; reelected to the Seventy-ninth and to the three succeeding Congresses (January 3, 1945-January 3, 1953); was not a candidate for reelection but was elected in 1952 to the United States Senate; reelected in 1958 and again in 1964, and served from January 3, 1953, to January 3, 1971; unsuccessful candidate for reelection in 1970; chairman, Special Committee on Attempts to Influence Senators (Eighty-fourth Congress); resumed the practice of law with Occidental Petroleum Co. and became vice president and member of the board of directors; taught law at Vanderbilt University 1970-1972; member of the board of petroleum and coal companies; was a resident of Carthage, Tenn. until his death on December 5, 1998; interment in Smith County Memorial Gardens in Carthage, Tenn."
H000729,"A Representative from Louisiana; born in Lecompte, Rapides Parish, La., November 28, 1943; graduated from Forest Hill High School, Forest Hill, La., 1961; attended the National Aeronautics School, Kansas City, Kans.; businessman; business owner; chairman of the board, Forest Hill Neighborhood School; elected as a Republican to the One Hundredth and to the two succeeding Congresses (January 3, 1987-January 3, 1993); unsuccessful candidate for reelection to the One Hundred Third Congress in 1992; unsuccessful candidate for Governor of Louisiana in 1991; unsuccessful candidate for election to the United States House of Representatives in 1994, 1996, 2002, and 2014; unsuccessful candidate for lieutenant governor of Louisiana in 2003; Louisiana state director, Office of Rural Development, United States Department of Agriculture, 2006-2009; member of the Louisiana public service commission, 2009-2016; died on October 16, 2016, in Forest Hill, La."
