id,bio
C000312,"A Representative from Texas; born in Washington, D.C., March 8, 1945; graduated from Sulphur Springs High School, Sulphur Springs, Tex., 1963; B.B.A., University of Texas, Austin, Tex., 1968; J.D., Southern Methodist University School of Law, Dallas, Tex., 1970; admitted to the Texas State bar in 1970; lawyer, private practice; district attorney, Eighth Judicial District, 1976-1985; elected as a Democrat to the Ninety-ninth Congress by special election, to fill the vacancy caused by the resignation of United States Representative Sam B. Hall, Jr.; reelected to the five succeeding Congresses (August 3, 1985-January 3, 1997); not a candidate for reelection to the One Hundred Fifth Congress in 1996, but was an unsuccessful candidate for nomination to the United States Senate."
B001259,"A Representative from Iowa; born in Grinnell, Poweshiek County, Iowa, October 30, 1957; graduated from B.G.M. High School, Brooklyn, Iowa; B.A., Iowa State University, 1980; J.D., University of Iowa, 1983; lawyer, private practice; elected as a Democrat to the One Hundred Tenth and to the three succeeding Congresses (January 3, 2007-January 3, 2015); not a candidate for reelection, but was an unsuccessful candidate for election to the United States Senate in 2014."
S000844,"A Representative from Maryland; born in Glen Ridge, Essex County, N.J., January 13, 1917; attended the public schools of White Plains, N.Y.; graduated from the Hotchkiss School, Lakeville, Conn., 1935; B.A., Yale University, 1939; Certificate of Advanced Meteorology, Massachusetts Institute of Technology, 1943; J.D., Yale Law School, 1948; admitted to the New York bar in 1958 and the District of Columbia bar in 1967; served in United States Army Air Corps, 1941-1946; employed by E.I. du Pont, 1939-1941, GAF Corp., 1948-1951, and the United States Atomic Energy Commission, 1951-1953; president of several investment companies in New York, 1953-1965; unsuccessful candidate for election in 1962 to the Eighty-eighth Congress; Maryland Republican State chairman, 1964-1966; Maryland State insurance commissioner, 1967-1970; in 1970, became Maryland Assistant Secretary, Licensing and Regulation; member, Maryland senate, 1971-1977; delegate, Republican National Convention, 1964 and 1984; elected as a Republican to the Ninety-fifth Congress (January 3, 1977-January 3, 1979); unsuccessful candidate for reelection in 1978 to the Ninety-sixth Congress and for election in 1980 to the Ninety-seventh Congress; unsuccessful candidate for election as lieutenant governor of Maryland in 1982; was a resident of Bethesda, Md., until his death there on February 11, 1993."
N000033,"A Senator from Wisconsin; born in Clear Lake, Polk County, Wis., June 4, 1916; attended the public schools of Clear Lake; graduated from the San Jose (Calif.) State College in 1939 and from the University of Wisconsin Law School in 1942; admitted to the Wisconsin bar the same year; during the Second World War served as a lieutenant in the United States Army for four years, serving overseas in the Okinawa campaign; engaged in the practice of law in Madison, Wis., in 1946; elected to the State senate in 1948, 1952, and 1956, and served as Democratic floor leader for four years; Governor of Wisconsin 1959-1962; elected as a Democrat to the United States Senate in November 1962 for the term commencing January 3, 1963; subsequently served out his term as Governor until January 7, 1963, and commenced his term in the Senate on January 8, 1963; reelected in 1968 and 1974 and served from January 8, 1963, to January 3, 1981; unsuccessful candidate for reelection in 1980; chairman, Select Committee on Small Business (Ninety-third through Ninety-sixth Congresses), Special Committee on Official Conduct (Ninety-fifth Congress); founder of Earth Day 1970; counselor, The Wilderness Society, Washington, D.C.; awarded the Presidential Medal of Freedom on September 29, 1995; was a resident of Kensington, Md., until his death due to cardiovascular failure on July 3, 2005; remains cremated and buried in family plot in Clear Lake, Wisconsin."
F000088,"A Representative from New York; born in Newburgh, Orange County, N.Y., August 26, 1935; graduated from Marymount School, Tarrytown, N.Y., 1952; B.A., Marymount College, New York, N.Y., 1956; J.D., Fordham University School of Law, New York, N.Y., 1960; lawyer, private practice; assistant district attorney, Queens County, N.Y., 1974-1978; elected as a Democrat to the Ninety-sixth and to the two succeeding Congresses (January 3, 1979-January 3, 1985); was not a candidate for reelection to the Ninety-ninth Congress in 1984, but was the unsuccessful Democratic candidate for Vice President of the United States; fellow of the Institute of Politics, John F. Kennedy School of Government, Harvard University, Cambridge, Mass., 1988-1992; president, International Institute for Women's Political Leadership; unsuccessful candidate for nomination to the United States Senate in 1992 and 1998; permanent member, United Nations Commission on Human Rights, 1993-1996; died on March 26, 2011, in Boston, Mass."
C000153,"A Representative from Illinois; born in Aurora, Kane County, Ill., December 30, 1915; educated in the public schools of Aurora, Ill; attended North Central College, Naperville, Ill.; B.A., University of New Mexico, 1939; United States Naval Reserve; manufacturer; delegate, Republican National Conventions in 1960, 1964, and 1968; Republican State Central Committeeman; elected as a Republican to the Ninety-second Congress in a special election, to fill the vacancy caused by the resignation of United States Representative Charlotte T. Reid (April 4, 1972-January 3, 1973); was not a candidate for reelection to the Ninety-third Congress in 1972; unsuccessful candidate for election to the Ninety-fourth Congress in 1974; died in Dixon, Ill., August 28, 1977; interment in Oak Hill Cemetery, Geneva, Ill."
S000798,"A Representative from New York; born in New York, N.Y., August 14, 1909; attended public schools in New York, N.Y. and Buffalo, N.Y.; B.A., University of Buffalo, Buffalo, N.Y., 1930; LL.B.,University of Buffalo, Buffalo, N.Y., 1933; J.D., University of Buffalo, Buffalo, N.Y., 1933; lawyer, private practice; assistant district attorney of Erie County, N.Y., 1938-1942; elected as a Republican to the Seventy-eighth Congress (January 3, 1943-January 3, 1945); was not a candidate for renomination to the Seventy-ninth Congress in 1944; appointed counsel to the New York State Employees' Retirement System, 1945-1955; assistant attorney general, New York State Law Department, Albany, N.Y., 1955-1979; died on February 29, 1996, in Kenmore, N.Y.; interment in Mount Olivet Cemetery, Tonawanda, N.Y."
M000455,"A Representative from New York; born in New York City May 15, 1902; attended parochial schools, was graduated from Clason Military Academy, Bronx, N.Y., in 1921 and from Fordham University School of Law, New York City, in 1924; was admitted to the bar in 1927 and commenced the practice of law in New York City; member of the State assembly, 1928-1935; elected judge of the Municipal Court of New York City in 1935, reelected in 1945 for ten year term, and served until his resignation on December 31, 1948; elected as a Democrat to the Eighty-first and Eighty-second Congresses (January 3, 1949-January 3, 1953); was not a candidate for renomination in 1952; elected judge of the Surrogate's Court of Bronx County in 1952 for a fourteen-year term; reelected in 1966; former member of faculty of Fordham University School of Law; was a resident of New York City until his death there July 7, 1986."
I000039,"A Representative from Connecticut; born of American parents in Argentina September 7, 1926; came to the United States in 1945 to attend Yale University; entered the United States Army and served with the Joint Brazil-United States Military Commission in Rio de Janeiro; reentered Yale University and graduated in 1951 and also from Yale Law School in 1954; was admitted to the bar and commenced the practice of law in Connecticut; taught Spanish at Yale University while a student there; member of Norwalk Board of Education; elected as a Democrat to the Eighty-sixth Congress (January 3, 1959-January 3, 1961); unsuccessful candidate for reelection in 1960 to the Eighty-seventh Congress; appointed general counsel, United States Information Agency, 1961; appointed treasurer of the State of Connecticut by Gov. John N. Dempsey, 1962; elected to the Eighty-ninth and the Ninetieth Congresses (January 3, 1965-January 3, 1969); unsuccessful candidate for reelection in 1968 to the Ninety-first Congress; resumed the practice of law; elected mayor of Norwalk, Conn., in November 1971; reelected in 1973 and was not a candidate for reelection in 1975; died on July 7, 2013, in Norwalk, Conn.; interment in St. John Cemetery."
P000618,"a Representative from California; born in Fort Dodge, Webster County, Iowa, January 3, 1974; B.A., Yale University, New Haven, Conn., 1996; J.D., Harvard University, Cambridge, Mass., 2001; law professor; staff, office of the attorney general, Calif. state department of justice, 2012-2014; faculty, University of California, Irvine, Calif., 2011-2018; elected as a Democrat to the One Hundred Sixteenth and to the two succeeding Congresses (January 3, 2019-present)."
O000019,"a Representative from California; born in Chicago, Cook County, Ill., August 18, 1970; graduated from Edison High School, Fresno, Calif., 1988; B.S., California Institute of Technology, Pasadena, Calif., 1992; M.S., University of California, Los Angeles, Calif., 1997; D.P.A., California Baptist University, Riverside, Calif., 2020; entrepreneur; pilot; member of the Big Bear, Calif., airport board of directors, 2005-2010; member of the Big Bear, Calif., city council, 2010-2014; Mayor of Big Bear, Calif., 2012-2014; member of the California state assembly, 2014-2020; Delegate, Republican National Convention, 2016; elected as a Republican to the One Hundred Seventeenth and to the succeeding Congress (January 3, 2021-present)."
M000183,"A Representative from North Carolina; born in Savannah, Chatham County, Ga., December 11, 1935; graduated from Mt. Zion High School, Winnsboro, S.C., 1953; B.S., Davidson College, Davidson, N.C., 1957; Ph.D., Princeton University, Princeton, N.J., 1960; faculty, Davidson College, Davidson, N.C., 1960-1970; Mecklenburg County, N.C., Commissioner, 1966-1972; founder and first chairman, Centralina Regional Council of governments, 1966-1969; delegate, Republican National Convention, 1968; elected as a Republican to the Ninety-third and to the five succeeding Congresses (January 3, 1973-January 3, 1985); was not a candidate for reelection in 1984 but was elected Governor of North Carolina for the four-year term beginning January 5, 1985; is a resident of Lake Norman, N.C."
W000682,"A Representative from Michigan; born in Los Angeles, Los Angeles County, Calif., November 3, 1939; attended the public schools of Los Angeles; graduated from University High School, Los Angeles, 1956; B.A., Reed College, Portland, Oreg., 1960; Ph.D., Massachusetts Institute of Technology, Cambridge, Mass., 1967; associate professor, Western Michigan University, Kalamazoo, Mich., 1967-1972; regional representative to United States Senator Donald Riegle of Michigan, 1976-1978; member, Michigan state legislature, 1972-1976; Kalamazoo City Commissioner, 1969-1972; delegate, Michigan state Democratic conventions, 1972-1978; elected as a Democrat to the Ninety-sixth and to the six succeeding Congresses (January 3, 1979-January 3, 1993); was not a candidate for renomination in 1992 to the One Hundred Third Congress; died on October 25, 2011, in Saugatuck, Mich."
F000467,"A Representative from Iowa; born in Dubuque, Dubuque County, Iowa, December 27, 1988; graduated from Hempstead High School, Dubuque, Iowa, 2007; U.S. Capitol Page School, 2006; B.A., Drake University, Des Moines, Iowa, 2011; legislative assistant; staff, Iowa state house; member of the Iowa state house, 2015-2019; elected as a Democrat to the One Hundred Sixteenth Congress (January 3, 2019-January 3, 2021); unsuccessful candidate for reelection to the One Hundred Seventeenth Congress in 2020; unsuccessful candidate for nomination to the United States Senate in 2022."
T000474,"a Representative from California; born in Escuintla, Guatemala on April 4, 1965; graduated from Mountain View High School, El Monte, Calif., 1983; attended Mount San Antonio College, Walnut, Calif., 1999-2000; attended Rio Hondo College, Whittier, Calif.; B.A., National Labor College, Silver Spring, Md., 2012; emergency 9-1-1 dispatcher; sales representative; member of Pomona, Calif., city council, 2000-2006; Mayor of Pomona, Calif., 2006-2008; member of the California state assembly, 2008-2013; member of the California state senate, 2013-2014; elected as a Democrat to the One Hundred Fourteenth and to the four succeeding Congresses (January 3, 2015-present)."
C000293,"(Great-great-grandnephew of Zachariah Chandler), a Representative from Washington; born in La Grande, Union County, Oreg., July 13, 1942; attended public schools; B.S., Eastern Oregon College, La Grande,Oreg., 1968; M.Ed., University of Nevada, Las Vegas, Nev., 2004; public relations consultant and TV news correspondent; served in Oregon Army National Guard, 1959-1964; elected to the Washington house of representatives, 1974-1982; served on the King County Metro Council, 1974-1975; delegate, Washington State Republican conventions, 1976, 1978, and 1980; elected as a Republican to the Ninety-eighth and to the four succeeding Congresses (January 3, 1983-January 3, 1993); was not a candidate for renomination in 1992 to the One Hundred Third Congress but was an unsuccessful candidate for the United States Senate; is a resident of Aurora, Colo."
W000428,"A Representative from Mississippi; born in Cascilla, Tallahatchie County, Miss., April 18, 1910; attended the public schools and the literary and law departments of the University of Mississippi at Oxford; was admitted to the bar in 1932 and commenced the practice at Charleston, Miss.; principal of the Cowart School in Tallahatchie County, Miss., in 1930 and 1931; member of the State house of representatives in 1931 and 1932; elected district attorney of the seventeenth district of Mississippi, 1933-1941; elected as a Democrat to the Seventy-seventh Congress by special election, November 4, 1941, to fill the vacancy caused by the resignation of Wall Doxey; reelected to the twenty-six succeeding Congresses and served from November 4, 1941, to January 3, 1995; not a candidate for reelection to the One Hundred Fourth Congress; cochairman, Joint Committee on Budget Control (Ninety-second and Ninety-third Congresses); chairman, Committee on Appropriations (Ninety-sixth through One Hundred Second Congresses); died in Oxford, Miss., on September 9, 1995; interment in Charleston Cemetery, Charleston, Miss."
P000134,"A Representative from New York; born in Troy, Rensselaer County, N.Y., April 29, 1932; graduated from Albany (N.Y.) Academy, 1949; A.B., Cornell University, Ithaca, 1953; LL.B., same university, 1957; admitted to the New York bar in 1957 and commenced practice in Troy; served in the United States Army, 1954-1956; served as Rensselaer County (N.Y.) treasurer, 1970-1975; unsuccessful candidate for election in 1970 to the Ninety-second Congress; unsuccessful candidate for Rensselaer County Executive, 1973; elected as a Democrat to the Ninety-fourth and to the Ninety-fifth Congresses (January 3, 1975-January 3, 1979); unsuccessful candidate for reelection in 1978 to the Ninety-sixth Congress; was a resident of West Sand Lake, N.Y., until his death there on August 22, 1990; interment in Oakwood Cemetery, Troy, N.Y."
S000851,"A Representative from Texas; born in Stamford, Jones County, Tex., October 26, 1938; graduated from Stamford High School, Stamford, Tex., 1957; A.S., Tarleton State Junior College, Stephenville, Tex., 1959; B.S., Texas Tech University, Lubbock, Tex., 1961; M.S., Texas Tech University, Lubbock, Tex., 1962; farmer; teacher; business executive; delegate, Democratic National Convention, 1972; elected as a Democrat to the Ninety-sixth and twelve succeeding Congresses (January 3, 1979-January 3, 2005); unsuccessful candidate for reelection in 2004."
Y000062,"A Representative from Kentucky; born in Louisville, Jefferson County, Ky., November 4, 1947; graduated from J. M. Atherton High School, Louisville, Ky., 1965; B.A., Yale University, New Haven, Conn., 1969; attended Georgetown University Law School, Washington, D.C., 1971-1972; staff, United States Senator Marlow Cook of Kentucky, 1971-1975; writer; publisher; television commentator; associate vice president, University of Louisville; health care executive; elected as a Democrat to the One Hundred Tenth and to the seven succeeding Congresses (January 3, 2007-January 3, 2023); was not a candidate for reelection to the One Hundred Eighteenth Congress in 2022; chair, Committee on Budget (One Hundred Sixteenth and One Hundred Seventeenth Congresses)."
F000430,"A Representative from Florida; born in Jacksonville, Duval County, Fla., August 20, 1933; when four years old moved with his family to a farm in Calhoun County, near Altha, Fla.; attended public schools; student at the University of Florida at Gainesville, 1951-1953; served in the United States Army Medical Corps during the Korean War, 1953-1955; returned to the University of Florida and graduated in 1957; engaged in operation of general farm and dairy; member of State house of representatives from Calhoun County, 1958-1962; delegate, Democratic National Convention, 1968; elected as a Democrat to the Eighty-eighth and to the eleven succeeding Congresses (January 3, 1963-January 3, 1987); chairman, Committee on Science and Technology (Ninety-sixth through Ninety-ninth Congresses); was not a candidate for reelection to the One Hundredth Congress; president, Aerospace Industries Association of America, 1987-1998; is a resident of Arlington, Va."
H001018,"A Representative from Florida; born in Midland City, Dale County, Ala., May 12, 1926; attended the Dale County public schools; B.S., Troy State University, 1949; graduate work in broadcasting, Northwestern University, Evanston, Ill., 1951; served in United States Navy, 1944-1946; worked as sports director and president of radio stations, 1954-1974; owner of an advertising agency, 1973-1979; elected to Florida house of representatives, 1972, reelected in 1974 and 1976; elected as a Democrat to the Ninety-sixth and to the seven succeeding Congresses (January 3, 1979-January 3, 1995); not a candidate for reelection to the One Hundred Fourth Congress; died on December 14, 2020, in Pensacola, Fla."
H001088,"a Representative from Minnesota; born in Blue Earth, Faribault County, Minn., August 4, 1962; graduated from Langley High School, McLean, Va.; B.A., George Mason University, Fairfax, Va., 1993; staff, United States Representative Arlan Ingehart Stangeland of Minnesota, 1984-1991; staff, United States Treasury Department, 1991-2009; unsuccessful candidate for nomination to the One Hundred Twelfth Congress in 2010; unsuccessful candidate for election to the One Hundred Fourteenth Congress in 2014, and One Hundred Fifteenth Congress in 2016; elected as a Republican to the One Hundred Sixteenth and to the succeeding Congress, and served until his death (January 3, 2019-February 17, 2022); died on February 17, 2022; interment at Riverside Cemetery, Blue Earth, Minn."
C000017,"(Grandson of Donelson Caffery), a Representative from Louisiana; born near Franklin, St. Mary Parish, La., July 6, 1932; attended public schools of Franklin and Hanson Memorial High School; B.A., University of Southwestern Louisiana, 1955; J.D., Louisiana State University Law School, 1956; associate and managing editor, Louisiana Law Review, 1955-1956; was admitted to the bar in 1956 and commenced practice in New Iberia, La.; assistant district attorney, sixteenth judicial district of Louisiana, 1958-1962; elected to Louisiana house of representatives, 1964-1968; elected as a Democrat to the Ninety-first and Ninety-second Congresses (January 3, 1969-January 3, 1973); was not a candidate for reelection in 1972 to the Ninety-third Congress; resumed the practice of law; died on December 17, 2013, in New Iberia, La."
F000448,"A Representative from Arizona; born in Uravan, Montrose County, Colo., June 19, 1957; attended Ottawa University, Ottawa, Kans.; business owner; member of the Arizona state house of representatives, 1985-1987; elected as a Republican to the One Hundred Eighth and to the seven succeeding Congresses until his resignation on December 8, 2017 (January 3, 2003-December 8, 2017)."
G000556,"a Representative from Florida; born in the Bronx, Bronx County, N.Y., March 13, 1958; graduated from Bronx High School of Science, Bronx, N.Y.; A.B., Harvard University, Cambridge, Mass., 1978; M.P.P., Harvard University, Cambridge, Mass., 1983; J.D, Harvard University, Cambridge, Mass., 1983; assistant, U.S. Circuit Court of Appeals, Washington, D.C.; lawyer, private practice; businessman; unsuccessful candidate for election to the One Hundred Tenth Congress in 2006; elected as a Democrat to the One Hundred Eleventh Congress (January 3, 2009-January 3, 2011); unsuccessful candidate for reelection to the One Hundred Twelfth Congress in 2010; elected as a Democrat to the One Hundred Thirteenth and to the succeeding Congress (January 3, 2013-January 3, 2017); was not a candidate for reelection to the One Hundred Fifteenth Congress in 2016, but was an unsuccessful candidate for nomination to the United States Senate; unsuccessful candidate for nomination to the One Hundred Sixteenth Congress in 2018; unsuccessful candidate for election to the One Hundred Seventeenth Congress in 2020; unsuccessful candidate for nomination to the One Hundred Eighteenth Congress in 2022."
G000402,"A Representative from Pennsylvania; born in Baton Rouge, East Baton Rouge Parish, La., August 20, 1941; attended the public schools; graduated from Simon Gratz High School, Philadelphia, Pa., 1959; B.A., Franklin and Marshall College, Lancaster, Pa., 1963; M.Div., Drew Theological Seminary, Madison, N.J., 1966; Th.M., Princeton Theological Seminary, New Jersey, 1970; minister; taught at St. Peter's College, Jersey City, N.J., 1970-1974, Jersey City State College, 1968-1969, Rutgers University, 1971, and Montclair (N.J.) State College, 1970-1972; elected as a Democrat to the Ninety-sixth and to the six succeeding Congresses, and served until his resignation September 11, 1991 (January 3, 1979-September 11, 1991); chairman, Committee on the Budget (Ninety-ninth and One Hundredth Congresses); majority whip (One Hundred First and One Hundred Second Congresses); president, United Negro College Fund; special adviser to the President and secretary of state for Haitian affairs, 1994; died on July 1, 2013, in London, England."
M000720,"A Representative from Florida; born in Highland Park, Wayne County, Mich., May 30, 1942; graduated from Manatee High School, Bradenton, Fla., 1960; B.S., University of Florida, Gainesville, 1964; M.B.A., Emory University, Atlanta, Ga., 1965; Ph.D., Louisiana State University, Baton Rouge, La., 1970; faculty, Georgia State University, Atlanta, Ga.; faculty, University of South Florida, Sarasota, Fla.; businessman; elected as a Republican to the One Hundred Third and to the four succeeding Congresses (January 3, 1993-January 3, 2003); not a candidate for reelection to the One Hundred Eighth Congress in 2002."
D000611,"A Representative from Hawaii; born in Los Angeles, Los Angeles County, Calif., August 9, 1970; graduated from Punahou School, Honolulu, Hawaii, 1988; B.A., University of Pennsylvania, Philadelphia, Pa., 1992; B.S., University of Pennsylvania, Philadelphia, Pa., 1992; J.D., University of Southern California, Los Angeles, Calif., 1996; United States Army Reserve, 2001-present; lawyer, private practice; vice chairman, Hawaii Republican Party, 1998-1999; member of the Hawaii state house of representatives, 2000-2002, minority floor leader, 2001-2002; member of the Honolulu, Hawaii city council, 2002-2010; elected as a Republican to the One Hundred Eleventh Congress, by special election, to fill the vacancy caused by the resignation of United States Representative Neil Abercrombie (May 22, 2010-January 3, 2011); unsuccessful candidate for reelection to the One Hundred Twelfth Congress in 2010; unsuccessful candidate for election to the One Hundred Thirteenth Congress in 2012; unsuccessful candidate for nomination to the One Hundred Fourteenth Congress in 2014; unsuccessful candidate for Mayor of Honolulu, Hawaii, in 2016."
