id,bio
N000127,"A Representative from Minnesota; born in Brainerd, Crow Wing County, Minn., December 17, 1943; graduated from Brainerd High School, Brainerd, Minn.,, 1962; attended St. John's University, Collegeville, Minn., 1962; B.A., University of Minnesota, Minneapolis, Minn., 1966; postgraduate work in public administration and policy formation, University of Maryland, College Park, Md., 1966; postgraduate work in education, St. Cloud State College, St. Cloud, Minn.; pursued a career in business and education; teacher of social studies in Royalton, Minn., schools, 1968-1972; member of the Minnesota state house of representatives, 1969-1973; elected as a Democrat to the Ninety-fourth and to the two succeeding Congresses (January 3, 1975-January 3, 1981); was not a candidate for reelection to the Ninety-seventh Congress in 1980; president, United States Export Corporation, 1981-1986; president, Minnesota World Trade Center, St. Paul, Minn., 1987-1994; business executive and owner; elected as a Democrat to the One Hundred Thirteenth and to the two succeeding Congresses (January 3, 2013-January 3, 2019); was not a candidate for reelection to the One Hundred Sixteenth Congress in 2018, but was an unsuccessful candidate for nomination as lieutenant governor of Minnesota."
G000574,"a Representative from Arizona; born in Chicago, Cook County, Ill., November 20, 1979; A.B., Harvard University, Cambridge, Mass., 2004; United States Marine Corps, 2002-2006; public affairs consultant, 2007-2008; Delegate, Democratic National Convention, 2008; member of the Arizona state house of representatives, 2010-2014, assistant minority leader, 2012-2014; elected as a Democrat to the One Hundred Fourteenth and to the four succeeding Congresses (January 3, 2015-present)."
D000278,"A Representative from Maryland; born in Cabana, Cuba, February 20, 1903; attended the public schools of Maryland, the Army and Navy Preparatory School in Washington, D.C., the Tome School at Port Deposit, Md., LaVilla in Lausanne, Switzerland, and Loyola College, Baltimore, Md.; enlisted in the United States Marine Corps in 1923; commissioned a second lieutenant in 1925 and advanced through grades to brigadier general in 1948; served in Nicaragua, Cuba and China; prisoner of war from December 1941 to January 1945; retired from the service in 1948; engaged in farming near Glyndon, Md., in 1946; elected as a Republican to the Eighty-second and to the three succeeding Congresses (January 3, 1951-January 3, 1959); was not a candidate for renomination in 1958 but was an unsuccessful candidate for Governor; director of public safety for Baltimore County, December 1962 to 1966; was a resident of Ruxton, Md., until his death in Baltimore on August 5, 1988; interment in Arlington National Cemetery."
C001111,"A Representative from Florida; born in Altoona, Blair County, Pa., July 24, 1956; graduated from St. Petersburg High School, St. Petersburg, Fla., 1974; attended Wake Forest University, Winston-Salem, N.C.; B.A., Florida State University, Tallahassee, Fla., 1978; J.D., Cumberland School of Law, Birmingham, Ala., 1981; lawyer, private practice; unsuccessful candidate for election to the Florida state senate in 1986; staff, United States Senator Connie Mack of Florida, 1989; member of the Florida state senate, 1993-1999; Florida deputy secretary of business and professional regulation, 1999-2001; Florida state education commissioner, 2001-2003; Florida state attorney general, 2003-2007; Governor of Florida, 2007-2011; unsuccessful candidate for election to the United States Senate in 2010; unsuccessful candidate for election for Governor of Florida in 2014; elected as a Democrat to the One Hundred Fifteenth and to the two succeeding Congresses until his resignation on August 31, 2022 (January 3, 2017-August 31, 2022); unsuccessful candidate for Governor of Florida in 2022."
P000049,"A Representative from New Jersey; born in New Brunswick, Middlesex County, N.J., December 29, 1960; graduated, Alma Preparatory School, Zarephath, N.J.; attended Seton Hall University, South Orange, N.J.; insurance executive and partner, Pappas Insurance Agency; chairman, human services and education steering committee, National Association of Counties; member, national policy forum, Republican National Committee; president, New Jersey Association of Counties, 1994; chairman, New Jersey Judicial Unification Transition Committee; Somerset County freeholder, 1984-1986, serving as director, deputy director, and board of social services chairman; member, Franklin Township council, 1982-1987; mayor, Franklin Township, 1983-1984; elected as a Republican to the One Hundred Fifth Congress (January 3, 1997-January 3, 1999); unsuccessful candidate for reelection to the One Hundred Sixth Congress; regional administrator, United States Small Business Administration, 2001-2003; associate administrator of field operations, United States Small Business Administration, 2001-2009; is a resident of Branchburg, N.J."
L000496,"A Representative from Texas; born in Grapevine, Tarrant County, Tex., May 1, 1908; attended the public schools, the North Texas Teachers College at Denton, the Oklahoma Agricultural and Mechanical College at Stillwater, and the Texas University at Austin; studied law; was admitted to the bar in 1938 and commenced practice in Grapevine, Tex.; served as an enlisted man in the United States Army from 1943 to 1945 with overseas service in the European Theater of Operations; resumed the practice of law; elected as a Democrat to the Eightieth and to the three succeeding Congresses (January 3, 1947-January 3, 1955); unsuccessful candidate for renomination in 1954 to the Eighty-fourth Congress; resumed the practice of law in Texas; government relations executive with General Electric in New York City, 1958-1966; executive director of the Mid-Appalachia College Council, 1966-1986; was a resident of Bristol, Tenn., until his death there on May 26, 1989; interment in Grapevine Cemetery, Grapevine, Tex."
F000452,"A Resident Commissioner from Puerto Rico; born in San Juan, P.R., October 31, 1960; B.S.F.S., Georgetown University, Washington, D.C., 1982; J.D., University of Virginia, Charlottesville, Va., 1985; lawyer, private practice; executive director, Puerto Rico Tourism Company, 1993-1996; secretary, Puerto Rico Economic Development and Commerce, 1994-1996; elected as a New Progressive to the One Hundred Ninth Congress to a four-year term (January 3, 2005-January 3, 2009); caucused with the Republican Party; was not a candidate for reelection to the One Hundred Eleventh Congress in 2008, but was a successful candidate for Governor of Puerto Rico; Governor of Puerto Rico, 2009-2013."
C000189,"A Representative and a Senator from Colorado; born in Denver, Colo., July 30, 1901; attended the public schools; during the First World War served in the United States Army 1918-1919; graduated from Westminster Law School, Denver, Colo., in 1929; admitted to the bar the same year and commenced practice in Denver, Colo.; assistant United States district attorney 1933-1934; district attorney of Denver 1937-1941; regional attorney for the Office of Price Administration 1942-1943; served in the Second World War as a commissioned officer in the United States Army 1943-1945; resumed the practice of law; elected as a Democrat to the Eightieth and Eighty-first Congresses (January 3, 1947-January 3, 1951); was not a candidate for renomination in 1950 but was an unsuccessful candidate for election as a Democrat to the United States Senate in 1950 and again in 1954; special assistant to President Harry Truman 1951-1952; elected as a Democrat to the United States Senate in 1956 and served from January 3, 1957, to January 3, 1963; unsuccessful candidate for reelection in 1962; was a resident of Denver, Colo. until his death on August 31, 1983; interment at Ft. Logan National Cemetery, Denver, Colo."
D000605,"A Representative from Virginia; born in Elyria, Lorain County, Ohio, November 20, 1949; graduated from Elyria High School, Elyria, Ohio, 1967; realtor; business owner; member of the Virginia state house of delegates, 1996-2004; elected as a Republican to the One Hundred Ninth and to the succeeding Congress (January 3, 2005-January 3, 2009); unsuccessful candidate for reelection to the One Hundred Eleventh Congress in 2008."
S000119,"A Representative from California; born in the Bronx, New York City, January 5, 1945; attended public schools in New York City and Los Angeles; graduated from Hamilton High School, Los Angeles, Calif., 1962; B.A., University of California, Los Angeles, 1967; J.D., University of San Diego, San Diego, Calif., 1970; London School of Economics, post-graduate studies in international law, 1970-1971; deputy attorney general, California State attorney general's office, criminal division; attorney, San Diego Gas and Electric Co., 1972-1976; special assistant to Vice Presidents Nelson A. Rockefeller and Walter F. Mondale, 1976-1977; deputy secretary, California State Department of Business, Transportation and Housing, 1977-1980, secretary, 1980-1983; attorney in private practice, 1983-1993; California co-chair for the presidential campaign of Michael S. Dukakis in 1988; commissioner and vice chair, San Diego unified port district, 1990-1993; elected as a Democrat to the One Hundred Third Congress (January 3, 1993-January 3, 1995); unsuccessful candidate for reelection to the One Hundred Fourth Congress."
A000376,"A Representative from Texas; born in Dallas, Dallas County, Tex., April 15, 1983; graduated from Hillcrest High School, Dallas, Tex., 2001; B.A., Baylor University, Waco, Tex., 2005; J.D., University of California, Berkeley, Calif., 2014; professional athlete; nonprofit executive; lawyer; staff, United States Department of Housing and Urban Development, 2016-2017; elected as a Democrat to the One Hundred Sixteenth and to the two succeeding Congresses (January 3, 2019-present)."
H001047,"a Representative from Connecticut; born in Lima, Peru, July 5, 1966; graduated from Hopewell Valley Central High School, Pennington, N.J.; A.B., Harvard University, Cambridge, Mass., 1988; M. Phil., Oxford University, Oxford, England, 1990; banking executive; non-profit executive; member of the Greenwich, Conn., housing authority, 2003-2006; chairman, 2003-2006; member of the Greenwich, Conn., board of estimate and taxation, 2006-2007; elected as a Democrat to the One Hundred Eleventh and to the seven succeeding Congresses (January 3, 2009-present); chair, Select Committee on Economic Disparity and Fairness in Growth (One Hundred Seventeenth Congress)."
S001141,"A Senator from Alabama; born in Hybart, Ala., December 24, 1946; attended the public schools; graduated from Huntingdon College, Montgomery 1969; graduated from University of Alabama School of Law, Tuscaloosa 1973; admitted to the Alabama bar in 1973, and engaged in the practice of law in Russellville 1973-1975; served in the U.S. Army reserves 1975-1985, attaining the rank of captain; practiced law in Mobile 1977-1981; United States Attorney for the Southern District of Alabama 1981-1993; Alabama Attorney General 1994-1996; elected as a Republican to the United States Senate in 1996; reelected in 2002, 2008, and again in 2014, and served from January 3, 1997, until his resignation on February 8, 2017, to accept a Cabinet position; Attorney General in the Cabinet of President Donald Trump, 2017-2018."
S000772,"A Representative from Florida; born in Bayonne, Hudson County, N.J., April 29, 1910; attended the public schools; B.A., Lehigh University, Bethlehem, Pa., 1931; J.D., University of Pennsylvania Law School, Philadelphia, 1934; M.A., in public law and government, Columbia University, New York City, 1938; instructor in economics, Hunter College of the University of the City of New York; builder, real estate investor; banking profession; admitted to the New York bar in 1934 and commenced practice in New York City; served in the United States Coast Guard, 1942-1946; city commissioner-mayor, Pompano Beach, 1965-1969; sheriff, Broward County, 1968-1978; delegate, Florida State Democratic conventions, 1977-1978; member, Democratic National Finance Council, 1976-1978; elected as a Democrat to the Ninety-sixth Congress (January 3, 1979-January 3, 1981); unsuccessful candidate for renomination in 1980 to the Ninety-seventh Congress; resumed the practice of law; unsuccessful candidate for election to the Ninety-eighth Congress in 1982; was a resident of Pompano Beach, Fla., until his death on November 3, 1989."
D000051,"A Representative from Georgia; born in Hancock County, Ga., November 22, 1943; graduated from Sparta High School, Sparta, Ga.,1961; A.B., University of Georgia, Athens, Ga., 1965; J.D., University of Georgia, Athens, Ga., 1967; lawyer, private practice; assistant district attorney, Cobb County, Ga., 1968-1972; district attorney, Cobb County, Ga., 1973-1976; elected to the Georgia state house of representatives, 1980-1983; elected as a Democrat to the Ninety-eighth Congress by special election to fill the vacancy caused by the death of United States Representative Larry McDonald; reelected to the Ninety-ninth and to the four succeeding Congresses (November 8, 1983-January 3, 1995); unsuccessful candidate for reelection to the One Hundred Fourth Congress; unsuccessful candidate for nomination to the One Hundred Eighth Congress in 2002; delegate to the Democratic National Convention, 1996, 2000, and 2004; board of trustees, LaGrange College, LaGrange, Ga."
D000044,"A Representative from California; born in Long Beach, Los Angeles County, Calif., September 22, 1929; attended the Trinity Lutheran School, Los Angeles, 1943; graduated from Long Beach Poly High School, 1946; attended Santa Maria Junior College, 1947; B.A., Valparaiso University, Indiana, 1950; J.D., Hastings Law School, University of California, 1952; served in the United States Army, 1952-1954; admitted to the California bar in 1953 and commenced practice in Santa Barbara, 1955; deputy district attorney, 1955-1957; Fullerton assistant city attorney, 1959-1962; served in the California State assembly, 1963-1966 and 1977-1978; municipal and superior court judge pro tempore, 1966-1976; delegate to California State Republican conventions, 1972 and 1976-1978; elected as a Republican to the Ninety-sixth and to the six succeeding Congresses (January 3, 1979-January 3, 1993); one of the managers appointed by the House of Representatives in 1989 to conduct the impeachment proceedings against Walter L. Nixon, judge of the United States District Court for the District Court of Mississippi; was not a candidate for renomination to the One Hundred Third Congress in 1992 but was an unsuccessful candidate for nomination to the United States Senate; died on July 9, 2019, in Thousand Palms, Calif."
W000803,"A Senator from Virginia; born in St. Joseph, Mo., February 9, 1946; graduated high school in Bellevue, Neb.; attended University of Southern California 1963-1964; graduated United States Naval Academy 1968; J.D., Georgetown University Law School 1975; served in the United States Marines 1968-1972; author, screenwriter, and journalist; lawyer; Secretary of the Navy 1987-1988; elected as a Democrat to the United States Senate in 2006, and served from January 3, 2007, to January 3, 2013; was not a candidate for reelection to the Senate in 2012."
M000058,"A Representative from New Jersey; born in Columbus, Franklin County, Ohio, March 11, 1939; attended Budlong Elementary School, Los Angeles, Calif.; graduated, Ridgewood (N.J.) High School, 1956; B.A., Oberlin (Ohio) College, 1961; Ph.D., government, Harvard University, 1966; advisor on political and security affairs, United States Department of State, 1966-1969; member, United States Delegation to the United Nations General Assembly for five sessions while with the United States Department of State; director, urban development program for Jamaica, N.Y., 1969-1972; consultant, National Affairs Division, Ford Foundation, 1972-1974; elected as a Democrat to the Ninety-fourth, Ninety-fifth and Ninety-sixth Congresses (January 3, 1975-January 3, 1981); unsuccessful candidate for reelection in 1980 to the Ninety-seventh Congress; industrial and labor consultant, 1981; unsuccessful candidate for nomination to the United States Senate in 1982; fellow, Institute of Politics, John F. Kennedy School of Government, Harvard University, 1983; vice president for policy, World Resources Institute, 1984-1987; chief executive officer, North American Securities Administrators Association, 1987-1989; president, EnterpriseWorks Worldwide, 1990-2002; is a resident of Ringoes, N.J."
P000405,"A Resident Commissioner from Puerto Rico; born in Bayam&oacute;n, P.R., October 30, 1920; attended elementary and high schools in Isabela, P.R.; University of Puerto Rico, B.A., 1941, and LL.B., 1943; was admitted to the bar in 1943 and practiced law in Isabela and San Juan; legal adviser to the Tax Court of Puerto Rico, 1943-1944; member of the American Bar and Puerto Rico Bar Associations; one of the founders of the Institute for Democratic Studies in San Jos&eacute;, Costa Rica; served in the House of Representatives, Commonwealth of Puerto Rico, 1949-1964; member of the Constitutional Convention of Puerto Rico in 1951-1952; appointed speaker of the house, 1963-1964; elected as a Popular Democrat to the Eighty-Ninth Congress to a four-year term (January 4, 1965-January 3, 1969); unsuccessful candidate for reelection in 1968; resumed the practice of law; was a resident of San Juan, P.R., until his death there on January 18, 1988; interment in Municipal Cemetery, Isabela, P.R."
B000229,"A Representative from Virginia; born in Perquimans County, N.C., August 7, 1928; attended public schools of Virginia; graduated, Newport News High School, Newport News, Va., 1945; B.A., College of William and Mary, Williamsburg, Va., 1949; LL.B., Georgetown University Law Center, Washington, D.C., 1956; served, United States Air Force, 1951-1953; teacher; admitted to the Virginia bar, 1956; law clerk, United States Circuit Court of Appeals, District of Columbia Circuit, 1956-1957; partner, private law practice; member, Virginia senate, 1968-1983; delegate, Virginia State Republican conventions, 1976-1982; elected as a Republican to the Ninety-eighth and to the eight succeeding Congresses and served from January 3, 1983, until his death in Leesburg, Va., on September 11, 2000; interment in Peninsula Memorial Park Cemetery, Newport News, Va."
Z000003,"A Representative from New York; born in New York City, March 16, 1906; attended public schools; graduated from Columbia University in 1926 and from Columbia Law School in 1928; was admitted to the bar in 1929 and commenced the practice of law in New York City; lecturer, Practicing Law Institute and Law Science Institute; former assistant United States attorney for the southern district of New York; elected as a Democrat to the Eighty-fourth and to the three succeeding Congresses (January 3, 1955-January 3, 1963); unsuccessful candidate for renomination in 1962 to the Eighty-eighth Congress; resumed the practice of law; died in New York City, February 23, 1979; interment at Sharon Gardens, Valhalla, N.Y."
M001216,"a Representative from Florida; born in Winter Haven, Polk County, Fla., July 13, 1980; A.A., Florida State College, Jacksonville, Fla., 2005; B.S., American Military University, Charles Town, W. Va., 2010; United States Army; defense contractor; business owner; security advisor; elected as a Republican to the One Hundred Eighteenth Congress (January 3, 2023&ndash;present)."
D000217,"A Representative from Texas; born in Laredo, Webb County, Tex., April 8, 1947; graduated from Calallan High School, Corpus Christi, Tex., 1965; attended Baylor University, Waco, Tex., 1967; B.S., University of Houston, Houston, Tex., 1970; business owner; member of the Texas state house of representatives, 1979-1984; elected as a Republican to the Ninety-ninth and to the ten succeeding Congresses until his resignation on June 9, 2006 (January 3, 1985-June 9, 2006); majority whip (One Hundred Fourth Congress to One Hundred Seventh Congress); majority leader (One Hundred Eighth and One Hundred Ninth Congress)."
B000064,"(Wife of Howard Henry Baker and stepmother of Howard Henry Baker, Jr.), a Representative from Tennessee; born Edith Irene Bailey, November 17, 1901, in Sevierville, Sevier County, Tenn., attended the public schools of Sevierville and Maryville; studied music; deputy county court clerk, 1918-1922; deputy clerk and master, Chancery Court, Sevierville, Tenn., 1922-1924; Republican National Committeewoman for Tennessee 1960-1964; elected as a Republican to the Eighty-eighth Congress to fill the vacancy caused by the death of her husband, Howard H. Baker, serving from March 10, 1964, to January 3, 1965; was not a candidate in 1964 for renomination to the Eighty-ninth Congress; director, Public Welfare, city of Knoxville, 1965-1971; was a resident of Knoxville, Tenn., until her death in Loudon, Tenn., on April 2, 1994; in Sherwood Memorial Gardens, Alcoa, Tenn."
B001242,"A Representative from New York; born in Southampton, Suffolk County, N.Y., June 1, 1950; graduated from Southampton High School, Southampton, N.Y., 1968; A.B., Holy Cross College, Worcester, Mass., 1972; M.A., Long Island University, Long Island, N.Y., 1981; administrator, Southampton College, Southampton, N.Y., 1973-2002; elected as a Democrat to the One Hundred Eighth and to the five succeeding Congresses (January 3, 2003-January 3, 2015); unsuccessful candidate for reelection to the One Hundred Fourteenth Congress in 2014."
L000344,"A Representative from California; born in Jackson, Mich., August 19, 1915, and moved to Los Angeles, Calif., with his parents in 1920; attended the Los Angeles public schools, the University of Southern California, and Woodbury College; engaged in public accountancy since 1940; during the Second World War served in the Finance Corps, United States Army; elected a member of the State assembly in 1947, and reelected in 1948, 1950, and 1952; delegate to the Republican National Convention in 1956; elected as a Republican to the Eighty-third Congress by special election, November 10, 1953, to fill the vacancy caused by the resignation of Norris Poulson; reelected to the Eighty-fourth and to the seven succeeding Congresses, and served from November 10, 1953, until his death in Bethesda, Md., February 1, 1970; interment in Forest Lawn Memorial Park, Hollywood Hills, Los Angeles, Calif."
K000249,"(Nephew of Claude Kitchin and William Walton Kitchin and grandson of William Hodges Kitchin), a Representative from North Carolina; born in Scotland Neck, Halifax County, N.C., September 13, 1908; educated in the public schools; attended Oak Ridge Military Institute 1923-1925; graduated from Wake Forest Law School in 1930; was admitted to the bar in 1930 and commenced the practice of law in Scotland Neck, N.C.; with Federal Bureau of Investigation, Washington, D.C., from January 1933 to August 1945; resumed the practice of law in Wadesboro, N.C.; elected as a Democrat to the Eighty-fifth, Eighty-sixth, and Eighty-seventh Congresses (January 3, 1957-January 3, 1963); unsuccessful candidate for election in 1962 to the Eighty-eighth Congress; resumed the practice of law; was a resident of Wadesboro, N.C., until his death there on October 22, 1983; interment in East View Cemetery, Wadesboro, N.C."
L000081,"A Representative from Maryland; born in Wilmington, New Castle County, Del., July 22, 1914; attended private schools in Baltimore, Md., and Alexandria, Va.; B.S., University of Virginia, Charlottesville, Va., 1937; LL.B., University of Maryland, Baltimore, Md., 1940; lawyer, private practice; engaged in active management of tobacco and cattle farms; United States Naval Reserve, 1942-1946; member of the Maryland house of delegates, 1948-1954; unsuccessful Democratic candidate for election to the Eighty-third Congress in 1952; member of Maryland Legislative Council, 1953; delegate, Democratic National Convention, 1956; elected as a Democrat to the Eighty-fourth and to the four succeeding Congresses (January 3, 1955-January 3, 1965); was not a candidate for renomination to the Eighty-ninth Congress in 1964; died on September 22, 2003, Easton, Md.; interment in Saint James Episcopal Church Cemetery, Lothian, Anne Arundel County, Md."
M001193,"A Representative from New Jersey; born in Milford, New Haven County, Conn., October 16, 1960; graduated from RHAM High School, Hebron, Conn., 1978; B.A., Hofstra University, Hempstead, N.Y., 1982; insurance executive and CEO; member of the Randolph, N.J., city council, deputy mayor, mayor, 2011-2014; elected as a Republican to the One Hundred Fourteenth and to the succeeding Congress (January 3, 2015-January 3, 2019); unsuccessful candidate for reelection to the One Hundred Sixteenth Congress in 2018."
B000420,"A Representative from Arkansas; born in Stuttgart, Arkansas County, Ark., August 27, 1942; graduated from DeWitt High School, DeWitt, Ark.; B.S., University of Arkansas for Medical Sciences, 1965; farmer; Gillett, Ark., city council, 1976-1980; Arkansas Soil and Water Conservation Commission, 1986-1994; White House Domestic Policy Council, 1993-1996; special assistant to President William Clinton for Agricultural Trade and Food Assistance, 1993-1996; elected as a Democrat to the One Hundred Fifth and to the six succeeding Congresses (January 3, 1997-January 3, 2011); was not a candidate for reelection to the One Hundred Twelfth Congress in 2010."
